Glycogen/data/20260320_mgig_wholetissue_weights_GlycogenGlo.csv

SampleID,Weight (mg)
0.0A,16.3
0.0B,21.4
0.0C,21.9
6.0A,11.5
6.0B,14.0
6.0C,26.9
6.2A,15.6
6.2B,20.7
6.2C,17.0
6.7A,9.2
6.7B,41.1
6.7C,5.3
18.0A,19.3
18.0B,12.0
18.0C,21.0
18.2A,21.9
18.2B,20.4
18.2C,21.4
18.7A,12.3
18.7B,20.3
18.7C,14.5
24.0A,21.6
24.0B,17.4
24.0C,15.6
24.2A,12.8
24.2B,23.6
24.2C,0.0
24.7A,19.5
24.7B,10.3
24.7C,22.9
48.0A,15.6
48.0B,16.8
48.0C,14.6
48.2A,26.7
48.2B,33.7
48.2C,22.0
48.7A,25.4
48.7B,9.2
48.7C,12.4

Glycogen/code/Gen5-20260323-tempprelim-mgig-glycogenglo.md

## The following objects are masked from 'package:base':

Plate layout1:
    'data.frame':   8 obs. of  12 variables:
     $ V1 : chr  "0.0A-glyc-16.3-df.20" "6.0A-glyc-11.5-df.20" "6.0B-glyc-14.0-df.20" "6.0C-glyc-26.9-df.20" ...
     $ V2 : chr  "0.0A-glyc-16.3-df.20" "6.0A-glyc-11.5-df.20" "6.0B-glyc-14.0-df.20" "6.0C-glyc-26.9-df.20" ...
     $ V3 : chr  "0.0A-glyc-16.3-df.20" "6.0A-glyc-11.5-df.20" "6.0B-glyc-14.0-df.20" "6.0C-glyc-26.9-df.20" ...
     $ V4 : chr  "6.2B-glyc-20.7-df.20" "6.2C-glyc-17.0-df.20" "6.7A-glyc-9.2-df.20" "6.7B-glyc-41.1-df.20" ...
     $ V5 : chr  "6.2B-glyc-20.7-df.20" "6.2C-glyc-17.0-df.20" "6.7A-glyc-9.2-df.20" "6.7B-glyc-41.1-df.20" ...
     $ V6 : chr  "6.2B-glyc-20.7-df.20" "6.2C-glyc-17.0-df.20" "6.7A-glyc-9.2-df.20" "6.7B-glyc-41.1-df.20" ...
     $ V7 : chr  "0.0A-glu-16.3-df.20" "6.0A-glu-11.5-df.20" "6.0B-glu-14.0-df.20" "6.0C-glu-26.9-df.20" ...
     $ V8 : chr  "0.0A-glu-16.3-df.20" "6.0A-glu-11.5-df.20" "6.0B-glu-14.0-df.20" "6.0C-glu-26.9-df.20" ...
     $ V9 : chr  "0.0A-glu-16.3-df.20" "6.0A-glu-11.5-df.20" "6.0B-glu-14.0-df.20" "6.0C-glu-26.9-df.20" ...
     $ V10: chr  "6.2B-glu-20.7-df.20" "6.2C-glu-17.0-df.20" "6.7A-glu-9.2-df.20" "6.7B-glu-41.1-df.20" ...
     $ V11: chr  "6.2B-glu-20.7-df.20" "6.2C-glu-17.0-df.20" "6.7A-glu-9.2-df.20" "6.7B-glu-41.1-df.20" ...
     $ V12: chr  "6.2B-glu-20.7-df.20" "6.2C-glu-17.0-df.20" "6.7A-glu-9.2-df.20" "6.7B-glu-41.1-df.20" ...